hospital_id,region_id,hospital_name,hospital_alternative_name,latitud,longitud,Consultas,Quirofanos,GRDxEgreso,Bienes y servicios,Remuneraciones,Dias Cama Disponibles,Consultas Urgencias,Examenes
101100,15,Hospital Dr. Juan Noé Crevanni (Arica),Hospital Doctor Juan Noé,-18.4827,-70.3126,1523529,0.0,13340.13406,50334232,30252055,113311.0,776401,9871289248
102100,1,Hospital Dr. Ernesto Torres Galdames (Iquique),Hospital Iquique,-20.2139,-70.1383,1031005,0.0,15365.164719999999,77818223,34267299,161383.0,585481,7109962255
201319,1,Hospital de Alto Hospicio,Hospital de Alto Hospicio,-20.2948,-70.0971,53240,0.0,-297.0,9905087,4541493,8189.0,0,106902579
103100,2,Hospital Dr. Leonardo Guzmán (Antofagasta),Hospital de Antofagasta,-23.6597,-70.3959,1875830,0.0,19240.3925,91389907,63882824,196717.0,387498,11714162169
103101,2,Hospital Dr. Carlos Cisternas (Calama),Hospital de Calama,-22.445,-68.9181,829780,0.0,7980.879199999999,37079367,17936386,72833.0,320466,4178529851
103102,2,Hospital Dr. Marcos Macuada (Tocopilla),Hospital de Tocopilla,-22.0882,-70.1929,28628,0.0,-1126.0,6931367,2897737,14564.0,192165,726187445
103103,2,Hospital 21 de Mayo (Taltal),Hospital de Taltal,-25.4036,-70.4869,14304,0.0,-598.0,4020419,1137899,8008.0,110121,361064609
103104,2,Hospital de Mejillones,Hospital de Mejillones,-23.0931,-70.4575,1824,0.0,-167.0,3337842,1249733,3285.0,134426,291931850
104100,3,Hospital San José del Carmen (Copiapó),Hospital Regional de Copiapó,-27.3668,-70.3417,842021,0.0,10333.69376,43676488,27645948,110991.0,426047,5090533068
104101,3,Hospital Dr. Jerónimo Méndez Arancibia (Chañaral),Hospital de Chañaral,-26.3442,-70.6071,91,0.0,-414.0,2754175,656350,13715.0,97679,248473606
104103,3,Hospital Provincial del Huasco Monseñor Fernando Ariztía Ruiz (Vallenar),Hospital de Vallenar,-28.5765,-70.3578,440851,0.0,4140.31464,20378997,12109016,41610.0,253880,2256915143
104104,3,Hospital Dr. Manuel Magalhaes Medling (Huasco),Hospital de Huasco,-28.4568,-70.2929,1868,0.0,-166.0,3575263,917987,3776.0,103227,205905179
105100,4,Hospital San Juan de Dios (La Serena),Hospital La Serena,-29.9065,-70.2432,1151026,0.0,12728.50896,64527015,41520768,122444.0,388144,7914818745
105101,4,Hospital San Pablo (Coquimbo),Hospital Coquimbo,-30.0168,-71.2544,927738,0.0,14307.257450000001,61059424,36870714,122749.0,330082,7178243838
105102,4,Hospital Dr. Antonio Tirado Lanas (Ovalle),Hospital Ovalle,-30.5991,-71.2124,809748,0.0,6864.09075,48304598,22819684,80208.0,308020,7382928282
105103,4,Hospital Dr. Humberto Elorza Cortés (Illapel),Hospital Illapel,-31.6277,-71.3682,384887,0.0,-3780.0,13058420,5212870,25935.0,141431,1436174385
105104,4,Hospital de Salamanca,Hospital Salamanca,-31.6344,-71.3425,8992,0.0,-405.0,5486279,2535358,6977.0,238493,619643359
105105,4,Hospital San Juan de Dios (Combarbalá),Hospital Combarbalá,-31.2125,-71.2355,1842,0.0,-301.0,3251524,966437,7347.0,53568,230007296
105106,4,Hospital Dr. José Arraño (Andacollo),Hospital de Andacollo,-29.9047,-71.5976,2475,0.0,-150.0,2956519,1081930,5476.0,65247,249391206
105107,4,Hospital San Juan de Dios (Vicuña),Hospital Vicuña,-30.0309,-70.7087,2121,0.0,-595.0,3705620,1307468,10702.0,124877,806744193
105108,4,Hospital San Pedro (Los Vilos),Hospital Los Vilos,-31.9075,-71.5144,53858,0.0,-634.0,6060648,2195381,12405.0,149671,899189417
106100,5,Hospital Carlos Van Buren (Valparaíso),Hospital Carlos Van Buren,-33.0458,-71.6229,869084,0.0,16751.011749999998,76905513,46923389,155019.0,485945,9691330096
106103,5,Hospital Claudio Vicuña ( San Antonio),Hospital Claudio Vicuña,-33.5996,-71.5598,367417,0.0,5070.5109999999995,24540562,17713791,60422.0,319575,4491685971
106104,5,Hospital Del Salvador (Valparaíso),Hospital Del Salvador,-33.0472,-71.3567,58319,0.0,-529.0,8679027,3480904,31854.0,0,2677672
106105,5,Hospital San José (Casablanca),Hospital San José Casablanca,-33.3205,-71.4102,1314,0.0,-302.0,4436157,1949865,4930.0,128884,80865994
106102,5,Hospital Dr. Eduardo Pereira Ramírez (Valparaíso),Hospital Doctor Eduardo Pereira,-33.0384,-71.6264,299926,0.0,5166.7968,19990003,10046251,56522.0,0,2447094195
107100,5,Hospital Dr. Gustavo Fricke (Viña del Mar),Hospital Doctor Gustavo Fricke,-33.0214,-71.5537,1311927,0.0,25148.558250000002,97604252,70599590,193722.0,634163,14997588076
107101,5,Hospital San Martín (Quillota),Hospital de Quillota,-32.8833,-71.2482,788800,0.0,7693.49335,46900703,29061014,88781.0,334094,7789978516
107102,5,Hospital de Quilpué,Hospital de Quilpué,-33.0458,-71.4457,414688,0.0,5105.01408,29019704,13271034,53144.0,301116,4188913204
107103,5,Hospital Dr. Mario Sánchez Vergara (La Calera),Hospital de La Calera,-32.7875,-71.2035,80016,0.0,-1460.0,7078084,1809186,15226.0,124768,413532079
107110,5,Hospital Centro Geriátrico Paz de la Tarde (Limache),Hospital Geriátrico Paz de la Tarde,-33.0098,-71.2544,25884,0.0,-433.0,4215978,945620,22418.0,0,1594864
107104,5,Hospital Santo Tomás (Limache),Hospital de Limache,-33.0103,-71.2549,60440,0.0,-1335.0,8505266,2019898,20805.0,185494,677971091
107105,5,Hospital San Agustín (La Ligua),Hospital de La Ligua,-32.4478,-71.2316,104211,0.0,-1026.0,7127941,1652854,21535.0,126446,636515127
107106,5,Hospital Dr. Víctor Hugo Moll (Cabildo),Hospital Cabildo,-32.4285,-71.0639,7147,0.0,-477.0,3470747,964335,7665.0,127200,367744855
107107,5,Hospital de Petorca,Hospital Petorca,-32.2594,-70.9392,7075,0.0,-293.0,2152462,642478,6570.0,74529,61295928
107108,5,Hospital Adriana Cousiño (Quintero),Hospital de Quintero,-32.7844,-71.5269,16911,0.0,-867.0,6508270,2486074,9216.0,196035,1091522379
107109,5,Hospital Juana Ross de Edwards (Peñablanca - Villa Alemana),Hospital Peñablanca,-33.0424,-71.3724,2905,0.0,-1836.0,7794622,2680958,29220.0,153029,467806472
108100,5,Hospital de San Camilo (San Felipe),Hospital San Camilo de San Felipe,-32.7521,-70.7254,464923,0.0,8208.36075,29582629,19500080,79880.0,314858,4074083550
108101,5,Hospital San Juan de Dios (Los Andes),Hospital San Juan de Dios de Los Andes,-32.8325,-70.5984,436873,0.0,7078.7266,23193321,14376406,57360.0,324474,3186751774
108102,5,Hospital San Francisco (Llaillay),Hospital San Francisco de Llay Llay,-32.8377,-70.9502,14130,0.0,-943.0,4209056,1296089,12450.0,187992,596378783
108104,5,Hospital San Antonio (Putaendo),Hospital San Antonio de  Putaendo,-32.6214,-70.7253,4392,0.0,-525.0,2337388,807009,10220.0,102473,53541643
108105,5,Hospital Psiquiátrico Dr. Philippe Pinel (Putaendo),Hospital Psiquiátrico Doctor  Philippe Pinel de Putaendo,-32.6212,-70.7263,0,0.0,-575.0,10985190,3233448,94788.0,30758,0
115100,6,Hospital Regional de Rancagua,Hospital Rancagua,-34.1713,-70.7449,1588498,0.0,22531.72199,88292615,56541939,199181.0,608848,14043586924
115101,6,Hospital Santa Filomena (Graneros),Hospital Graneros,-34.0667,-70.7264,2098,0.0,-699.0,4348571,1028824,9490.0,198388,664602426
115102,6,Hospital de Coínco,Hospital Coínco,-34.2667,-70.9933,1524,0.0,-422.0,2650858,560624,5208.0,83940,182735823
115103,6,Hospital Del Salvador (Peumo),Hospital Peumo,-34.3903,-71.2542,1882,0.0,-602.0,3479855,1013780,17442.0,125995,442334666
115104,6,Hospital Dr. Ricardo Valenzuela Sáez (Rengo),Hospital de Rengo,-34.4065,-70.8587,280620,0.0,-5529.0,14157338,9999542,40885.0,293769,2660347701
115105,6,Hospital San Vicente de Tagua-Tagua,Hospital San Vicente,-34.4487,-70.9682,163976,0.0,-2706.0,7002968,2535882,17855.0,144435,1001626602
115106,6,Hospital de Pichidegua,Hospital Pichidegua,-34.2998,-71.2786,1055,0.0,-361.0,1941286,455068,4566.0,104080,195462710
115107,6,Hospital San Juan de Dios (San Fernando),Hospital San Fernando,-34.5817,-70.9899,765560,0.0,6239.98154,26790477,14910482,58701.0,386565,5284285526
115108,6,Hospital Mercedes (Chimbarongo),Hospital Chimbarongo,-34.7239,-71.0394,2087,0.0,-719.0,4140591,1144269,7300.0,146104,418428989
115109,6,Hospital de Nancagua,Hospital Nancagua,-34.7012,-71.1288,1576,0.0,-228.0,2359288,542267,3285.0,131361,266327466
115110,6,Hospital de Santa Cruz,Hospital Santa Cruz,-34.6364,-71.3657,336062,0.0,3859.9631400000003,15032927,9407642,32048.0,272667,2643485516
115111,6,Hospital de Marchigüe,Hospital Marchigue,-34.4231,-71.5873,937,0.0,-150.0,1805751,547315,3276.0,63635,292505447
115112,6,Hospital de Pichilemu,Hospital Pichilemu,-34.3869,-72.0095,23822,0.0,-561.0,3518543,1295887,8808.0,142315,625611226
115113,6,Hospital de Lolol,Hospital de Lolol,-34.7589,-71.6721,575,0.0,-163.0,1876002,416410,3650.0,63902,236203384
115114,6,Hospital de Litueche,Hospital de Litueche,-34.1344,-71.6822,1400,0.0,-115.0,2001027,585726,2920.0,80919,478514361
116100,7,Hospital San Juan de Dios (Curicó),Hospital Curicó,-34.9824,-71.2433,1055736,0.0,10425.58055,46205955,39639478,111121.0,364515,10027689375
116101,7,Hospital de Teno,Hospital de Teno,-34.8749,-71.1676,2554,0.0,-1017.0,3925097,1182568,9903.0,97075,366378958
116102,7,Hospital de Molina,Hospital Molina,-35.1155,-71.2826,17382,0.0,-1338.0,4670463,2884684,19065.0,174055,767882858
116103,7,Hospital de Hualañé,Hospital Hualane,-34.9768,-71.7986,2159,0.0,-424.0,2791571,975449,4380.0,61067,695804247
116104,7,Hospital de Licantén,Hospital Licantén,-34.9983,-71.8771,2042,0.0,-134.0,2827386,600384,2876.0,39934,200824509
116105,7,Hospital Dr. César Garavagno Burotto (Talca),Hospital Talca,-35.4232,-71.6485,2084850,0.0,30318.75,93293364,65555488,235629.0,521015,17191832029
116106,7,Hospital de Curepto,Hospital Curepto,-35.0834,-72.0038,1100,0.0,-326.0,2634787,785210,2910.0,47638,208929517
116107,7,Hospital de Constitución,Hospital Constitución,-35.3329,-72.4162,131411,0.0,-3067.0,8231936,2785614,28488.0,122777,734842049
116108,7,Hospital Presidente Carlos Ibáñez del Campo (Linares),Hospital Linares,-35.8487,-71.5901,725751,0.0,9775.38576,32535120,20588523,82719.0,277643,6504530692
116109,7,Hospital Dr. Abel Fuentealba Lagos de San Javier,Hospital San Javier,-35.5911,-71.7362,156003,0.0,-3508.0,7813079,3366236,23804.0,216873,1025635790
116110,7,Hospital San José (Parral),Hospital Parral,-36.1438,-71.8369,91053,0.0,3573.0809999999997,8679245,3432894,36541.0,230292,1214644997
116111,7,Hospital San Juan de Dios (Cauquenes),Hospital Cauquenes,-35.9637,-72.3228,203746,0.0,-4360.0,11000789,3914179,42128.0,135029,1024853786
116112,7,Hospital Dr. Benjamín Pedreros (Chanco),Hospital Chanco,-35.7335,-72.5435,1709,0.0,-524.0,2776414,826886,7721.0,109893,230290925
117101,16,Hospital Clínico Herminda Martín (Chillán),Hospital de Chillán,-36.6063,-72.1024,1704304,0.0,16677.56505,77781002,46802645,172394.0,599519,10690387507
117102,16,Hospital de San Carlos,Hospital de San Carlos,-36.4267,-71.9592,406222,0.0,5244.1506500000005,22816265,13980123,43611.0,383744,3910359798
117103,16,Hospital Comunitario de Salud Familiar de Bulnes,Hospital de Bulnes,-36.7411,-72.2996,9019,0.0,-1559.0,6040623,3347287,19074.0,289762,1349205795
117104,16,Hospital Comunitario de Salud Familiar Pedro Morales Campos (Yungay),Hospital de Yungay,-37.1013,-71.9325,3488,0.0,-1167.0,4796673,2416942,15698.0,162357,473099356
117106,16,Hospital Comunitario de Salud Familiar de Quirihue,Hospital de Quirihue,-36.2821,-72.5323,5170,0.0,-756.0,4375334,2243488,17684.0,111336,432407222
117108,16,Hospital Comunitario de Salud Familiar Dr. Eduardo Contreras Trabucco de Coelemu,Hospital de Coelemu,-36.4942,-72.7081,4026,0.0,-901.0,5125480,2401303,17135.0,128433,429448172
117107,16,Hospital Comunitario de Salud Familiar de El Carmen,Hospital El Carmen,-36.5639,-72.0405,3807,0.0,-684.0,3935174,1930907,8393.0,125082,429025063
118100,8,Hospital Clínico Regional Dr. Guillermo Grant Benavente (Concepción),Hospital Guillermo  Grant Benavente,-36.8201,-73.0503,2417753,0.0,36261.895670000005,143943162,93658895,302112.0,693294,16365725843
118103,8,Hospital Traumatológico (Concepción),Hospital Traumatológico,-36.8276,-73.0565,261438,0.0,-3662.0,14385195,11965484,36058.0,0,294981227
118105,8,Hospital San José (Coronel),Hospital de Coronel,-37.0302,-73.1412,203883,0.0,4554.6749,22044229,6362014,39555.0,488892,3125719410
118106,8,Hospital de Lota,Hospital Lota,-37.0887,-73.1581,297343,0.0,2421.07119,16962943,6983305,34402.0,241513,1798283661
118107,8,Hospital Clorinda Avello (Santa Juana),Hospital Santa Juana,-37.1696,-72.9339,1919,0.0,-643.0,3525135,1169899,14779.0,105226,112265841
118108,8,Hospital San Agustín de Florida,Hospital Florida,-36.8227,-72.6696,2006,0.0,-305.0,3592943,1603782,5840.0,104578,62536978
119100,8,Hospital Las Higueras (Talcahuano),Hospital Higueras,-36.7185,-73.1217,2150919,0.0,20263.983500000002,77688354,63561830,154308.0,509363,14086014622
119101,8,Hospital de Tomé,Hospital Tome,-36.6206,-72.9515,393240,0.0,2273.14056,16550595,6315713,33290.0,197557,1964306793
119102,8,Hospital Penco - Lirquén,Hospital Penco Lirquén,-36.7399,-72.9955,307555,0.0,-2412.0,15616291,7209052,21602.0,205254,2767247597
120107,8,Hospital Comunitario Dr. Roberto Muñoz Urrutia de Huépil,Hospital Huepil,-37.6869,-72.0197,1449,0.0,-641.0,3952610,1594434,6341.0,107148,645823007
120105,8,Hospital Comunitario de Laja,Hospital de Laja,-37.2837,-72.7105,2540,0.0,-860.0,5290916,2849575,10220.0,161623,681413304
120101,8,Complejo Asistencial Dr. Víctor Ríos Ruiz (Los Ángeles),Hospital de Los Ángeles,-37.4621,-72.3604,1628628,0.0,24735.664559999997,88082228,68262057,196512.0,638640,20539692357
120102,8,Hospital Comunitario de Mulchén,Hospital de Mulchén,-37.7222,-72.2329,4398,0.0,-1729.0,6979661,2836861,31767.0,341605,674182027
120103,8,Hospital Comunitario de Nacimiento,Hospital de Nacimiento,-37.5079,-72.6766,3842,0.0,-1179.0,5187772,1822488,16794.0,138896,675907003
120104,8,Hospital Comunitario de Yumbel,Hospital de Yumbel,-37.0846,-72.5645,5431,0.0,-1211.0,4838852,1830466,19344.0,183138,562620475
120106,8,Hospital Comunitario de Santa Bárbara,Hospital Santa Bárbara,-37.6637,-72.0153,2135,0.0,-674.0,4692137,1841742,11872.0,149524,464186369
128113,8,Hospital San Vicente (Arauco),Hospital Arauco,-37.2462,-73.3219,116472,0.0,-2085.0,11046927,5920817,20346.0,221603,1325745893
128111,8,Hospital Intercultural Kallvu Llanka (Cañete),Hospital de Cañete,-37.8047,-73.3832,110071,0.0,-3645.0,15978985,6665294,33101.0,220771,1261018769
128112,8,Hospital de Contulmo,Hospital Contulmo,-38.0172,-73.2277,2499,0.0,-240.0,3124573,1335413,3955.0,55460,244320048
128109,8,Hospital Provincial Dr. Rafael Avaría (Curanilahue),Hospital Curanilahue,-37.4764,-73.3437,198070,0.0,4543.3488,28913959,14716964,37377.0,241123,3746990619
128110,8,Hospital de Lebu,Hospital Lebu,-37.6088,-73.6595,10412,0.0,-1765.0,9866213,3680076,23209.0,181887,995835360
129100,9,Hospital Dr. Mauricio Heyermann (Angol),Hospital Angol,-37.7966,-72.7099,774791,0.0,6893.49488,37176582,15535925,82612.0,306588,4931939766
129106,9,Hospital San José de Victoria,Hospital Victoria,-38.2363,-72.3315,566980,0.0,5608.83822,27517215,12580220,64173.0,278913,3713470456
129104,9,Hospital Dr. Dino Stagno M.(Traiguén),Hospital Traiguén,-38.2502,-72.6886,55542,0.0,-1785.0,6992378,2539962,29565.0,186215,678159107
129103,9,Hospital de Collipulli,Hospital de Collipulli,-37.9536,-72.4364,4049,0.0,-729.0,5367666,2324551,9987.0,171497,582437379
129101,9,Hospital de Purén,Hospital Purén,-38.0503,-72.6734,1762,0.0,-584.0,3350507,1188382,8005.0,119017,549211690
129107,9,Hospital Dr. Oscar Hernández E.(Curacautín),Hospital Curacautín,-38.4353,-71.8888,6188,0.0,-844.0,4525461,1738098,8922.0,120681,957499689
129108,9,Hospital de Lonquimay,Hospital de Lonquimay,-38.4476,-71.2306,1650,0.0,-714.0,3448023,940982,7160.0,85642,428391378
121113,9,Hospital Dr. Eduardo González Galeno (Cunco),Hospital de Cunco,-38.9325,-72.0292,7671,0.0,-909.0,4282915,2434039,7824.0,130294,488748835
121114,9,Hospital Intercultural de Nueva Imperial,Hospital Nueva Imperial,-38.7449,-72.9503,272681,0.0,3218.9679199999996,19334372,18744562,53959.0,161763,6259649814
121121,9,Hospital de Villarrica,Hospital Villarica,-39.2868,-72.2278,329032,0.0,2551.19764,15883938,7757881,20815.0,252387,2401278437
121115,9,Hospital de Carahue,Hospital Carahue,-38.7082,-73.1669,4995,0.0,-699.0,4820095,2680876,10950.0,173150,512323484
121119,9,Hospital de Gorbea,Hospital Gorbea,-39.0973,-72.6763,3205,0.0,-522.0,3301681,1380060,9681.0,90233,422079810
121117,9,Hospital de Pitrufquén,Hospital Pitrufquén,-39.2291,-72.6402,187929,0.0,2384.8362,15672961,9109683,26494.0,156696,5111234180
121116,9,Hospital Dr. Arturo Hillerns Larrañaga (Saavedra),Hospital Puerto Saavedra,-38.7779,-73.4003,2420,0.0,-452.0,3172380,1385038,8851.0,87289,211730478
121118,9,Hospital de Toltén,Hospital Toltén,-39.2144,-73.2075,2835,0.0,-716.0,2939274,1076790,8486.0,92198,617437067
121111,9,Hospital de Galvarino,Hospital Galvarino,-38.4178,-72.7738,3549,0.0,-619.0,3123403,1313758,9125.0,124889,559397400
121110,9,Hospital Dr. Abraham Godoy (Lautaro),Hospital Lautaro,-38.5277,-72.4466,260573,0.0,1932.56304,15113795,9357354,26280.0,170933,5532313825
121120,9,Hospital de Loncoche,Hospital Loncoche,-39.3702,-72.6311,4567,0.0,-1039.0,4070595,1983257,15019.0,128754,1114773096
121112,9,Hospital de Vilcún,Hospital Vilcún,-38.6547,-72.2248,3443,0.0,-743.0,2951818,1358443,10522.0,124570,1008437162
121109,9,Hospital Dr. Hernán Henríquez Aravena (Temuco),Hospital Temuco,-38.7335,-72.5963,1338784,0.0,27146.96964,104472193,84456382,249330.0,596869,20491432751
200717,9,Complejo Asistencial Padre las Casas,Complejo Asistencial Padre Las Casas,-38.7676,-72.6156,374596,0.0,-6014.0,32031462,19050293,74018.0,237220,8019006518
122100,14,Hospital Clínico Regional (Valdivia),Hospital de Valdivia,-39.8099,-73.2459,1153053,0.0,18258.625,73996333,51580073,172835.0,366908,12698610774
122101,14,Hospital de Corral,Hospital de Corral,-39.8826,-73.4306,953,0.0,-281.0,2338529,889084,2582.0,56983,243079696
122102,14,Hospital de Los Lagos,Hospital de Los Lagos,-39.8561,-72.8254,0,0.0,-957.0,2506738,908499,12094.0,150012,505803724
122103,14,Hospital de Lanco,Hospital de Lanco,-39.4529,-72.7751,19287,0.0,-670.0,4797067,1193477,7300.0,111295,502737386
122104,14,Hospital Juan Morey (La Unión),Hospital de La Unión,-40.2931,-73.0812,73487,0.0,-3524.0,8839266,3134198,36812.0,185110,1259716589
122105,14,Hospital de Río Bueno,Hospital de Río Bueno,-40.3326,-72.9535,16936,0.0,-1998.0,5094052,1362866,20494.0,139250,537616996
122106,14,Hospital de Paillaco,Hospital de Paillaco,-40.0692,-72.8776,0,0.0,-990.0,3608566,749108,12174.0,198578,609599147
122200,14,Hospital de Mariquina,Hospital Santa Elisa De San Jose De La Mariquina,-39.5332,-72.9767,19683,0.0,-1216.0,3580030,1305136,18330.0,183551,500787805
123100,10,Hospital Base San José de Osorno,Hospital de Osorno,-40.5744,-73.1252,1239559,0.0,15958.4848,62421307,37636490,135103.0,531923,10487642661
123103,10,Hospital de Puerto Octay,Hospital Puerto Octay,-40.9736,-72.9002,751,0.0,-181.0,2681528,801565,3575.0,79839,259613204
123101,10,Hospital de Purranque,Hospital Purranque,-40.9074,-73.1689,35851,0.0,-1562.0,5148329,2183451,13573.0,152090,904718248
123102,10,Hospital de Río Negro,Hospital de Río Negro,-40.7839,-73.2163,4842,0.0,-347.0,3641661,942974,9708.0,168207,423380473
123105,10,Hospital del Perpetuo Socorro de Quilacahuín,Hospital del Perpetuo Socorro de Quilacahuín,-40.7554,-73.4516,346,0.0,-74.0,1969900,619266,3285.0,9591,67086431
124130,10,Hospital de Calbuco,Hospital Calbuco,-41.7726,-73.1315,22704,0.0,-875.0,7469134,2637095,11634.0,215631,1056561566
124120,10,Hospital de Fresia,Hospital de Fresia,-41.1517,-73.4081,6896,0.0,-378.0,3467355,1659975,7742.0,99130,354389983
124115,10,Hospital de Frutillar,Hospital de Frutillar,-41.1267,-73.0707,16481,0.0,-849.0,3312257,1430055,11669.0,109207,507180638
124145,10,Hospital de Futaleufú,Hospital Futaleufú,-43.1863,-71.8684,619,0.0,-177.0,2978948,1273369,2190.0,43222,145363188
124110,10,Hospital de Llanquihue,Hospital de Llanquihue,-41.2606,-73.0042,11634,0.0,-554.0,3006329,1326770,6814.0,188884,1063757213
124125,10,Hospital de Maullín,Hospital de Maullín,-41.6192,-73.6056,3721,0.0,-345.0,2959711,1378460,9069.0,64904,309135086
124140,10,Hospital de Palena,Hospital de Palena,-43.6161,-71.8036,45,0.0,-73.0,2178707,701669,1543.0,23706,87273194
124105,10,Hospital de Puerto Montt,Hospital de Puerto Montt,-41.4687,-72.9411,1739869,0.0,22678.64162,103367070,74074908,207903.0,506574,15829572259
125104,11,Hospital Dr. Jorge Ibar (Cisnes),Hospital de Cisnes,-44.7477,-72.6964,1787,0.0,-114.0,3010467,853679,3285.0,33902,199159190
125102,11,Hospital Dr. Leopoldo Ortega R. (Chile Chico),Hospital de Chile Chico,-46.5416,-71.7265,693,0.0,-162.0,3151986,1338598,2920.0,36841,130885220
125103,11,Hospital Lord Cochrane,Hospital de Cochrane,-47.2549,-72.5687,1825,0.0,-167.0,5261281,1727267,2555.0,37174,178250656
125100,11,Hospital Regional (Coihaique),Hospital de Coyhaique,-45.5713,-72.0661,497512,0.0,7843.12906,48817119,26259166,55437.0,390534,5344635446
125101,11,Hospital de Puerto Aysén,Hospital de Puerto Aysén,-45.4037,-72.6993,157955,0.0,-1724.0,15039667,9303932,16060.0,153126,1811193711
126102,12,Hospital Dr. Marco Antonio Chamorro ( Porvenir),Hospital Porvenir,-53.2984,-70.3683,1543,0.0,-310.0,4471016,1669840,5355.0,60108,142322778
126101,12,Hospital Dr. Augusto Essmann Burgos ( Natales),Hospital de Puerto Natales,-51.7264,-72.5143,89343,0.0,-1990.0,18238183,6253473,21971.0,203103,1495026140
126100,12,Hospital Clínico de Magallanes Dr. Lautaro Navarro Avaria,Hospital Regional de Punta Arenas,-53.1598,-70.9056,988014,0.0,11018.49546,62417246,36795123,114517.0,444082,12572537934
126704,12,Hospital Comunitario Cristina Calderón de Puerto Williams,Hospital Comunitario Cristina Calderon de Puerto Williams,-54.9334,-67.6108,533,0.0,-44.0,2113913,931490,1825.0,17863,40648375
112103,13,Instituto Nacional de Enfermedades Respiratorias y Cirugía Torácica,Hospital del Tórax,-33.4428,-70.6193,203330,0.0,8535.35466,21005748,28438633,46880.0,0,2738038015
112102,13,Hospital de Niños Dr. Luis Calvo Mackenna (Santiago - Providencia),Hospital Luis Calvo Mackenna,-33.4401,-70.6112,670009,0.0,9377.25801,41249899,35947383,66517.0,236414,4354219927
112101,13,Hospital Dr. Luis Tisné B. (Santiago - Peñalolén),Hospital Santiago Oriente Luis Tisne,-33.4711,-70.5302,77303,0.0,12937.21,36847157,21412708,107587.0,268158,1602987046
112100,13,Hospital Del Salvador (Santiago - Providencia),Hospital Salvador,-33.4345,-70.6196,1805969,0.0,10706.13144,67013312,81882076,122049.0,229347,13997265760
112106,13,Instituto Nacional Geriátrico Presidente Eduardo Frei Montalva,Instituto de Geriatría,-33.4269,-70.6456,141168,0.0,-1236.0,6156188,2086897,17155.0,0,1468358
112104,13,Instituto de Neurocirugía Dr. Alfonso Asenjo,Instituto de Neurocirugía,-33.4384,-70.6492,115603,0.0,6672.3174,18166876,12897917,30576.0,48237,3636662568
112105,13,Instituto Nacional de Rehabilitación Infantil Presidente Pedro Aguirre Cerda,Instituto Pedro Aguirre Cerda,-33.4285,-70.6498,47276,0.0,-291.0,5843684,1608735,8857.0,0,6157457
112107,13,Hospital Hanga Roa (Isla De Pascua),Hospital de Hanga Roa,-27.1501,-109.4209,42215,0.0,-801.0,8107373,5347980,5840.0,94636,568013897
114104,13,Hospital Metropolitano (Ex Militar),Hospital Metropolitano de Santiago,-33.4188,-70.6051,0,0.0,-4108.0,24722844,12546037,64918.0,0,3504060991
111195,13,Hospital de Urgencia Asistencia Pública Dr. Alejandro del Río,Hospital De Urgencia Asistencia Publica,-33.4442,-70.6385,31238,0.0,16797.33594,78923716,34486517,108711.0,648022,8350300485
111100,13,Hospital Clínico San Borja-Arriarán (Santiago - Santiago),Hospital Clínico San Borja Arriaran,-33.4566,-70.6495,1526073,0.0,15661.785549999999,91965731,68030368,145383.0,355978,12133869782
111101,13,Hospital Clínico Metropolitano El Carmen Doctor Luis Valentín Ferrada,Hospital El Carmen,-33.5089,-70.7552,1047507,0.0,16839.26742,96323272,52427655,174290.0,764898,12523028305
111351,13,Centro de Referencia de Salud de Maipú,Centro de Referencia de Salud Maipú,-33.5116,-70.7603,268328,0.0,-564.0,7562490,5894704,12555.0,0,15215253
111351,13,Centro de Referencia de Salud de Maipú,Centro de Referencia de Salud Maipú,-33.5116,-70.7603,268328,0.0,-564.0,7352516,7088240,12555.0,0,15215253
113100,13,Hospital Barros Luco Trudeau (Santiago - San Miguel),Hospital Barros Luco Trudeau,-33.4866,-70.6614,1834121,0.0,28232.230720000003,98526292,71304081,261598.0,549820,17530681726
113160,13,Hospital de Enfermedades Infecciosas Dr. Lucio Córdova (Santiago - San Miguel),Hospital Enfermedades Infecciosas,-33.4984,-70.6529,98569,0.0,-1486.0,7597518,12718416,23141.0,0,4891044918
113130,13,Hospital Dr. Exequiel González Cortés (Santiago - San Miguel),Hospital Exequiel González Cortés,-33.5013,-70.6541,787018,0.0,7137.5244,33455227,15834437,56760.0,444496,1918961047
113150,13,Hospital San Luis (Buin),Hospital San Luis de Buin,-33.7336,-70.7478,252377,0.0,3685.6907199999996,17255756,5625502,35636.0,283314,2105053775
113170,13,Hospital Psiquiátrico El Peral (Santiago - Puente Alto),Hospital Sanatorio El Peral,-33.5876,-70.5704,2521,0.0,-177.0,6313719,1938830,44895.0,0,9303
113180,13,Hospital El Pino (Santiago - San Bernardo),Hospital Sanatorio El Pino,-33.6091,-70.7018,0,0.0,11385.33318,45266099,22119448,109975.0,322073,3604603526
109104,13,Hospital de Til Til,Hospital de Til Til,-33.1383,-70.8035,944,0.0,-267.0,4400115,1246956,8760.0,136353,38483294
109101,13,Hospital Clínico de Niños Dr. Roberto del Río (Santiago - Independencia),Hospital Roberto del Río,-33.4164,-70.6522,716830,0.0,8650.80216,42714653,18943463,63721.0,406741,3723221158
109100,13,Complejo Hospitalario San José (Santiago - Independencia),Hospital San José,-33.4074,-70.6415,1419338,0.0,19177.42134,89552312,54044327,207498.0,396909,14854418569
109103,13,Instituto Nacional del Cáncer Dr. Caupolicán Pardo Correa (Santiago - Recoleta),Instituto Nacional del Cáncer,-33.3986,-70.6413,403678,0.0,-2776.0,23398645,16390726,24806.0,0,4064538380
